Q_NUMBER,QUESTION,OPTION1,OPTION2,OPTION3,OPTION4,ANSWER,IMAGE
178,Maximum permissible speed of a two wheeler   near educational institution….,25 km/hour,30 km/hour,40 km/hour,,1,
179,Projection of load upto one metre (100 cms)  towards back is permitted…..,in tractor,in stationwagon,in goods carriages,,3,
180,When lorries are loaded…,The load can be projected to both sides  within  30 cm.,The load shall not project on both sides.,The load can be projected to both sides  within  50 cm.,,2,
181,Maximum length of load that can be projected  from the rear part of a goods carriage….,150 cm,100 cm,120 cm,,2,
182,Maximum permissible speed of  heavy motor  vehicles in the cities……..,35 Km/hr,45 Km/hr,60 Km/hr,,2,
183,Maximum distance allowed between towing and towed vehicles…..,15 meters,5 meters,10 meters,,2,
184,Maximum permissible speed of a motor cycle in  cities….,40 km/hour,30 km/hour,50 km/hour,,1,
185,"You are driving on a two-lane street, vehicle in     front of you is moving very slowly and the road  ahead is clear for overtaking, you should  .. ..",Pass the vehicle from the left hand side.,Pass the vehicle from the right hand side.,Pass the vehicle from any convenient side. ,,1,
186,Maximum speed permitted for vehicles towing  another vehicle…….,20 km/hour,24 km/hour,32 km/hour,,2,
187,Motor vehicle which is not permitted to drive in  ghat roads at a speed of  more than 30 Km/h…….,heavy passenger vehicle,motor car,Autorickshaw,,2,
188,Circumstances in which a motor cycle can be  driven at the speed of 60 km/hour…..,During night .,During day time.,Under no circumstances.,,3,
189,The maximum speed permitted for motor cycles  in city during night time….,25Km/hr,30 Km/hr,40 Km/hr,,2,
190,Maximum permitted weight that can be carried  on a goods carriage….,No limit,allowed as per permit,10 ton,,2,
191,The minimum fine for over - loading in goods  carriage….,Rs- 1000/-,Rs- 2000/-,Rs- 3000/-,,2,
192,Maximum permissible speed of an autorickshaw near educational inistitution….,35 km/hour,25 km/hour,20 km/hour,,2,
193,Maximum permissible speed of a light motor  vehicle near educational institution….,45 km/hour,35 km/hour,25 km/hour,,3,
194,Maximum permissible speed of motor car on  ghat roads….,40 km/hour,30 km/hour,20 km/hour,,1,
195,Maximum permissible speed of motor cycle on  ghat roads….,30 km/hour,35 km/hour,40 km/hour,,3,
196,Maximum permissible speed of an autorickshaw….,50  Km/hr,30 Km/hr,40 Km/hr,,3,
197,Maximum permissible speed of a light motor  vehicle….,60 Km/hr,70 Km/hr,No limit,,1,
198,Maximum permissible speed of a medium motorvehicle…,80 Km/hr,65 Km/hr,70 Km/hr,,2,
199,According to section 112 of the Motor Vehicles  Act  1988…,Speed limit shall not be exceeded,Shall not drive after consuming alcohol,Shall not use vehicle on road without paying tax,,1,
200,Section  113  of the Motor Vehicle  Act 1988  stipulates that the driver should not drive a  vehicle…..,After consuming alcohol.,Exceeding the speed limit,Exceeding the weight permitted to carry,,3,
201,Maximum speed allowed to vehicles passing a  procession….,15 KM/hr,25 KM/hr,35 KM/hr,,1,
202,The height limit of load on goods vehicle from  ground level…..,3.8 meters,3 meters,no limit.,,1,
203,Maximum permissible speed of heavy motor  vehicle near education inistitution….,35 km/hour,25 km/hour,15 km/hour,,3,
204,Maximum permissible speed of heavy passenger motor vehicle  near educational institution …..,35 km/hour,25 km/hour,15 km/hour,,3,
205,According to section 129  of Motor Vehicle  Act 1988 a person driving a motor cycle shall….,wear jerkins,wear helmet,wear shoes,,2,
206,Maximum permissible speed of a medium motor vehicle near educational institution….,15 km/hour,25 km/hour,35 km/hour,,1,
207,Maximum permissible speed of autorickshaws  on ghat road…..,30 km/hour,40 km/hour,20 km/hour,,1,
208,Maximum permissible speed of heavy motor  vehicles on ghat roads….,35 km/hour,25 km/hour,15 km/hour,,1,
209,Maximum permissible speed of autorikshaw in  cites and municipal towns…..,40 Km/hr,30 Km/hr,20 cm,,2,
210,Maximum permissible speed of heavy motor  vehicles….,70 Km/hr,65 Km/hr,50 Km/hr,,2,
211,Maximum permissible speed of medium motor  vehicles on ghat roads…,45 km/hour,35 km/hour,25 km/hour,,2,
212,"You wish to take ""U"" turn at an intersection controlled by a traffic light you should ….",Drive to another intersection that has no traffic  light,"Wait until the light turns green before making  the ""U"" turn","Make the ""U"" turn if there is a policeman at the  intersection",,3,
213,Zig-Zag driving is….,Dangerous to two-wheelers only,Dangerous to all at all times,Dangerous to four-wheelers vehicles,,2,
214,You are on a long downhill slope. What should you do to help control the speed of your vehicle ?,change to low gear,Stop the Engine,select neutral,,1,
215,To supervise a learner driver you MUST….,Be an approved driving instructor,Hold a Driving licence,Hold a learner’s licence,,1,
216,While on a round about,traffic entering has right of way,traffic existing has right of way,traffic on the roundabout has right of way,,3,
217,It is essential to wear a helmet while driving a two-wheeler because….,It is for your individual safety,Otherwise you will be caught by the traffic police,It is necessary for uniformity on the road,,1,
218,When you shall sound the horn of your vehicle ?,to give you right of way,to warn other drivers of your presence,to attract a friend’s attention,,1,
219,You are behind a bus that has stopped to pickup or drop off passengers you should…..,wait behind patiently,overtake from the left,overtake from the pedestrians,,1,
220,You are overtaking a car at night. You must ensure that….,you do not dazzle other road users,you flash headlamps before overtaking,your rear fog lights are switched on,,2,
221,The middle lane is for….,overtaking,two wheelers,traffic at 40 km/h,,3,
222,A flashing yellow signal is used when…..,traffic lights aren’t working,you should slow down & proceed with caution,men are at work,,2,
223,You  stop  for  pedestrians  waiting  to  cross   at   a           zebra crossing. They do not start to cross. What should    you do ?,sound your horn,be patient and wait,drive on,,2,
224,You are allowed to park….,on a footpath,at top of a hill,neither of these two alternatives,,3,
225,A high beam in foggy conditions….,is good because you can see more,is bad because it reflects back and can dazzle,make sure others can see you,,2,
226,Dipping your lights is necessary when…..,you want to overtake,it is foggy,following a vehicle,"Overtaking not 
permitted",2,
227,When  approaching  a  crossing  where you are  to  go       straight….,change lanes to the right lane,change lanes at least 50 mts ahead to the middle lane,change lanes to the middle lane at the crossing,,2,
228,"You are driving. A vehicle comes up quickly behind, flashing head lamps. You should…..",accelerate to maintain gap behind you,touch the breaks to show your brake lights,"allow the vehicle to over take, if safe",,3,
229,When must you use a dipped high beam headlight during the day ?,in poor visibility and highways,on country roads,along narrow streets,,1,
230,You are driving in rain. Why should you keep well back from the vehicle in front ?,in case it changes direction suddenly,in case its fog lights dazzle you,in case it stop suddenly,,3,
231,What can cause hard steering,badly worn tyre,over inflated tyre,under inflated tyre,,3,
232,Motor cyclists usually cause hazard by,Speed more than permitted,passing very close to you by driving in the zig zag manner,all of the above,,3,
233,"You are waiting at a T-Junction, A vehicle is coming from the left with right signal flashing, you should",accelerate hard and move forward ,move forward slowly,wait until the vehicle turn to right side,,3,
234,While you reach a junction with limited visibility you should,look both ways and move carefully,look at right and move slowly,move quickly,,1,
235,You should switch on your hazard warning lights,When you are moving straight,When your vehicle is parked and the same is causing inconvenience to other road users,when your vehicle  parked at a no parking area,,2,
236,"You are driving on a well-lit motor way at night, you must",use your head light on high beam,always use your head lights in low beam,always use hazard light,Switch off all lights,2,
237,Anti lock braking system prevents wheels from locking. This avoid tyres to ,Puncture,skid,wear,,2,
238,"While travelling over motor way at night with other vehicles just ahead, better the switched on lights should be",hazard warning light,low beam head light,high beam head light,,2,
239," A cyclist is signalling to turn right and drawn to center of the road, you should ",over take through left side,sound horn continually,overtake through right side only,,1,
240,Driving at high speed,gives you better fuel efficiency,take less time for your journey,reduces time to react to hazard,,3,
241,"While driving, avoid",observing traffic rules,reacting to wrong behaviour of other drivers,observing the dash board guages,,2,
242,The continuous yellow line in the centre of the road means,no parking,do not over take ,stop,,2,
243,In this carriage way you can drive,above 50 km/hr,below 50 km/hr.,up to a maximum legal speed permitted to your vehicle,,2,
244,When you approach a bridge you should,slow down and do not over take,beware of pedestrians,switch on the head lights,,1,
245,"When approaching a right hand curve, you should keep well to the left to",improve your view of the road ,avoid skid,to pass the vehicle from behind,,1,
246,"While you are approaching a staggered junction, You should ",slow the vehicle ,maintain your speed and sound the horn,use hazard warning light,,1,
247,At the Blind Junction you must stop,only if there is traffic on the main road,behind the line and move forward slowly as vision improves,only if you are turning to the right,,2,
248,"You entered  a one-way in the opposite direction unknowingly, you should",reverse out of the road,Turn back carefully and drive away,continue to the end of the road,,2,
249,"While driving through a main road another vehicle is reversing from a side road, You should",Move to the opposite side of the road,speed up and drive through quickly,sound your horn and be prepared to stop,,3,
250,"Approaching a cross road, the driver of the long vehicle ahead of you, signals right and moves to left, You should",sound horn and warn the driver,wait behind the vehicle,over take on the right hand side,,2,
251,Basic rule on a two lane high way is ,keep to the left lane unless over taking,keep the lane with the least traffic,always keep to the right lane at high speed ,,1,
252,"You meet an obstruction on your side of the road, You should",move on as you have priority,accelerate to move quickly,give way to on coming traffic,,3,
253,The white line along the side of the road ,means no parking,means no overtaking,edge of carriage way,,3,
254,The mandatory signs giving orders  are mostly in,Red/Blue circles,Red Triangles,Base triangles,,1,
255,This line means,cross it when ever you feel,cross it when it is safe and come back after over taking,not cross it under any circumstances,,2,
256,Vehicles adjacent to the solid line,can cross line for over taking,cannot cross  for over taking ,cannot stop,,2,
257,"Before you make an ""U"" turn you should ",Select the neutral gear and the indicator,"show the signal for a right turn , watch in the rear wiew mirror  ",wait for signal to turn red,,2,
258,"While taking ""U"" turn in this road, You should ",Move forward since prohibited,Look in the mirror give signal and turn,show the signal pass the vehicle from the opposite direction and turn,,1,
259,"When you are moving from a parking place, You should","use the rear view mirrors, check in the blind spot and give signal",look around the vehicle,sound horn and move ahead,,1,
260,When do you stop on a motor way ,when ordered by police or if traffic signal is red,in an emergency or brake down,all of the above,,3,
261,"You are intending to turn left , you should position your vehicle at ", the middle lane, the left hand lane,on the shoulder of the road,,2,
262,You are in a wrong lane while approaching a busy Junction you should,continue in that lane,stop until other lane is cleared,show signal and cut across,,1,
263,When going straight ahead at a round about,indicate right signal and then left signal,No signals is required,use hazard warning lamp,,2,
264,You must not reverse your vehicle ,on a busy road,on a one way road,all of the above,,3,
265,When do you reverse from a side road in to a main road,only if both roads are clear and empty,at any time,legally not permitted,,3,
266,"When approaching from the rear, where two lanes of traffic have stopped at a signal, you should",pass all the vehicle and stop in front of them,stop behind the last vehicle in the appropriate lane,stop any where,,2,
267,Rear Mirror is slightly curved to,give a wider field of vision,cover the blind spot totally,judge the speed of following vehicle,,1,
268,Noise pollution may result in,disturbing mental equilibrium,Disturbing the concentration of the driver,all of the above,,3,
269,Air pollution affects,Human beings only,plants and animals only,all of the above,,3,
270,Fitment of multi toned horns on a motor vehicle is ,permitted only in emergency,an offence under the law as it causes  noise pollution ,for avoiding accident,,2,
271,"Your vehicle pulls to one side while braking, You should",change the tyres around,pump the pedal when braking,consult your mechanic,,3,
272,What is the common cause of skidding,bad condition of tyres and road,error of driver,both of the above,,3,
273,"While travelling  you are dazzled by head lights of on coming vehicle, you should",pull down your sun visor,slow down and stop,switch on your main beam,,2,
274,What is blind spot,An area not seen in your rear view mirrors,an area not covered by head lights,an area not covered by the  rear view mirror inside your vehicle,,1,
275,"While approaching a road under repair, you comply the permitted speed limit",during day time and working is going on ,During night time only,at all times,,3,
276,Section 185 of MV Act pertains to,Driving at excessive speed,Drunken driving ,Both of the above,,2,
277,Dangerous driving is ,allowed in an emergency situation,punishable offence under section 184of M.V. act,both of the above are correct,,2,
279,"An accident has just happened and the injured person is lying on the road, you should ",protect the area and inform the authorities,protect the area and give first aid to injured,"protect the area, give first aid ,take the injured to the hospital  and inform the authorities",,3,
280,What is the main aim of the first aid,To treat the injury,To prevent aggravating the injury  and its effects,all of the above,,2,
281,How does alcohol affect your driving,It increase your awareness,it reduce your concentration and attention,it increase your confidence,,2,
282,Which of these lights will come after Amber at a traffic light,Red,Green,red or greeen,,1,
283,"While driving you start feeling tired or unable to concentrate, You should ",Stop as soon as it is safe to do so and take rest,switch on the stereo to help you concentrate,speed up to get your destination sooner,,1,
284,"You are drivng at night, what can you do to help you to keep alert?",takes proper rest periods at correct intervals,walk around in fresh air after a rest stop,both of the above,,2,
285,"You are driving a car during a journey you are feeling ill and unable to concentrate, what should you do?",increase your speed to finish your work earlier,continue your journey and keep your windows open,stop in a safe place and if possible seek for medical attention,,3,
286,Anti lock braking system is designed to ,prevent the driving wheel from spinning,prevent moisture from building up inside the braking system,prevent wheels from locking up on braking and avoid skidding of the tyres,,3,
287,"What is ""brake fade""",A reduction of air pressure,smooth progressive braking,reduction of braking effectiveness,,3,
288,To prevent brake fade while descending you should,select neutral for a short distance,repeatedly pump the brake pedal,select a suitable higher power gear and apply brakes if only necessary,,3,
289,"When stopping on an uphill gradient, one should ",Hold the vehicle on the clutch,Hold the vehicle on the foot brake,Hold the vehicle applying parking brake after stopping,,3,
290,"You are driving behind a large vehicle, how can you improve your view ahead?",Overtake as soon as you can,Move over to the left,Stay further back,,3,
291,While driving through a flooded road what should you do?,Stop the vehicle until the flood stops, Watch flood level guage drive in high torque gear with high acceleration,Drive in high torque gear with low acceleration,,2,
292,Driving the vehicle in a neutral gear in down hill is dangerous because it affects the,Cooling system,Speed governor ,Brake system,,3,
293,what is the benefit of   power assisted steering,Reduce tyre wear,assist with braking,reduce driving effort,,3,
294,How can you avoid harsh driving?,gently apply the parking brake,plan and take earlier action in using brake ,slow down by using gears only,,2,
295,On which occasions would passengers be most likely to notice weight transfer?,braking,cornering,both of the above,,3,
296,"Which of the following should you do before a bend, round about or corner?",select the appropriate gear,adjust your speed,both of the above,,3,
297,Hazard warning lamps may only be used at certain times,for going ahead at a junction,For slowing down the rear vehicle,for emergency parking especially on high ways and busy roads,,3,
298,A laminated safety wind screen glass is one which,will not shatter,has a plastic layer pasted between dual glasses,both of the above,,3,
299,What must you do if your vehicle is involved in an accident?,"stop at the scene of the accident, give First Aid to the victim if possible and help him to get medical attention ",drive the vehicle to the nearest police station,inform the insurance authorities at the earliest,inform to police,1,
300,"Your vehicle has hit a parked vehicle.  The owner of that vehicle could not be traced out  at the time, you must ",drive away from the accident spot and clear the damage at the earliest,inform the insurance authorities as soon as possible,inform the police station having jurisdiction over the place in which the accident occurred within 24 hours,,3,
301,While  driving your vehicle on a motor way a front tyre gets burst.  You should ,loosen  the grip on the steering wheel,brake firmly for a stop,hold the steering wheel firmly and stop safely by  using brake,,3,
302,Motor cyclist are advised to wear ------------------------type of clothing at night  to make them visible to other road users,bright clothing,dark clothing,none of this,,1,
303,"Before you open the right side doors on parking, you should",ensure that no vehicle is passing by ,quickly open the door and get down,do not open the right doors and get down through the left only,,1,
304,Which of the following is most important when loading a vehicle?,Loading it towards the rear,loading it towards the front,spreading the load evenly,,3,
305,You are driving a tipper vehicle carrying loose dry sand.  Why should you cover this load properly ?,"To stop handling being affective 
",to set your rear ward vision,to prevent sand being blown into the eyes of other road users,,3,
306,How many people can you carry over the load carried on a truck?,one,as per permit,none,,3,
307,What should be  checked first before turning to the left?,the right side mirror,the left side mirror,look behind over your right shoulders,,2,
308,You are about to move off you should always,using your mirrors  look behind and give proper signal,signal left with indicator and move,use only the off side mirror and move away quickly,,1,
309,At road junction which of the following are most at risk,Cyclist and motor cyclist,pedestrian,both,,3,
310,The turning circle of a vehicle is the,number of turns of the steering wheels between locked,amount by which a vehicle cuts corners,amount of space needed for the vehicle to turn,,3,
311,Before braking in wet condition you should make sure as far as possible that,the gear lever is in neutral,there is no mist or water in your rear view mirror,your vehicle is traveling slowly in a straight line,,3,
312,Your vehicle broken down on a motor way you have several passengers on board you should,stop the vehicle on the left side of the road as you can,move the passengers to the front of your vehicle,both,,1,
313,Wiper  fitted on the windscreen of a vehicle is ,only for rainy season,for cleaning the wind shield at any season,as a signal to the on coming vehicle to stop approaching,,2,
314,"A motor cycle rider observes a signboard which indicates ""Restrictions ends"", can he travel at a speed of ",more than 50 kmph,maximum speed of the vehicle,not more than 50km/hr,,3,
315,The correct procedure for stopping a vehicle not equipped with anti lock brake system,Apply the foot brake firmly in a pumping action until the vehicle has stopped,apply the foot brake firmly once until the vehicle has been stopped ,apply the foot brake and hand brake until the vehicle has stopped,,2,
316,You are driving a vehicle fitted with a speed governor you should be careful when,overtaking another vehicle,cornering,braking,,1,
317,Which of the following is a legal requirement for every vehicle?,First aid box,spare wheel,audio system,,1,
318,A driver of a motor car driving behind a long truck can keep a braking distance,1.2 meters,2.5 meters,safe distance,,3,
319,Traffic signs includes,all signals and warning sign posts,direction posts and marking on road,all of the above,,3,
320,What are the dangerous substances that can be carried on public service vehicle ,Explosives,fuel and lubricant of the vehicles,safely packed catridge of small arms,,2,
321,No driver of a motor vehicle shall sound horn on ,highways,prohibited areas by notification of the authority,rural roads,,2,
322,Which of the safety device fitted in Light Motor vehicle protects the driver from  injury,helmet,Seat belt,none of above,,2,
323,Basic safety requirements of a two wheeler,rear wheel cover/sari guard,crash guard,both of the above,,3,
324,Pedestrians should walk on the ----------------------side of the road,right,left,middle,,1,
325,Things to be checked before a long drive,"fuel, oil, brake fluid, coolant, condition of tyre","spare wheel, tools, tension of all drive belts",all of the above,,3,
326,Reverse driving is permitted only for,Minimum distance required for changing direction,during night driving,driving on ghat roads,,1,
327,Precautions to be followed during parking at night,park out side of the carriage way and use park light and hand brake,park the vehicle on foot path away from traffic,use tyre jacky to prevent roling,,1,
328,Use of LPG as fuel in vehicle ,is prohibited by law,can be used after certification from authorities,cannot be used even in case of modern LPG inbuilt models,,2,
329,Using LPG,Reduces pollution,cost effective,all of the above,,3,
330,On roads with defined lanes,use appropriate indicator signal before changing lanes,lane changing is prohibited by law,peep and see backwards through the front window before changing lanes,None of above,1,
331,Towing is permitted only for,mechanically disabled or incompletely assembled motor vehicles,registered travellers and side cars,all of the above,,1,
332,"During night, a car driving towards you with high beam on, the driver of that car is ",driving with bad manners since high beams blind others,a safe driver since high beam lights up the road,not obeying law,,1,
333,When you want to change from one lane to another you should .....,give proper turn signal,Look through Rear view mirror and change lane if it is safe to do,both of the above,,3,
334,"When you are driving in a four lane road, the vehicle in front of you is moving slowly and driving in the right lane and the road ahead is clear, for overtaking you should",pass the vehicle from the left side,pass the vehicle from the convenient side,pass the vehicle from the right hand side after getting signal from the vehicle at the front,,3,
335,"You are moving into the street from a parallel parking space, you should","blow horn and pull out slowly,",show signal to other traffic and then move carefully,proceed with caution  after making sure that there is no vehicle in the vicinity that may cause an accident,,2,
336,"While on a main road, another vehicle enters from a cross road, which vehicle has the ""Right of way""
",Vehicle on the main road,the vehicle approaching,none of the cars,,1,
337,"In lane traffic,before making a right turn you should be  in",any lane,extreme left lane,extreme right lane,,3,
338,If your vehicle hits a pedestrian you should,identify yourself and leave,"help the person, and call an ambulance",help the injured  for medical aid identify yourself and then report to police,,3,
339,You should not over take,when the road ahead is not visible,on straight road,in rural areas,,1,
340,Reversing is prohibited in ,main road,in one way,at T Junction,,2,
341,While driving on wet or slippery road,tyre pressure must be reduced,avoid sudden braking and acceleration ,vehicle should be driven at high speed ,,2,
342,"While driving a motor cycle behind a four wheeler , you should ",keep the motor cycle in the centre and behind the vehicle ahead,stay slightly on the right or left of the vehicle,none of the above,,2,
